{
  "window_id": "w0001",
  "line_id": "sprayline01",
  "batch_id": "batch-A",
  "segment_id": "seg-001",
  "start_time": "2026-05-10T09:00:00.000",
  "end_time": "2026-05-10T09:00:00.200",
  "reference": {
    "nominal_pressure_bar": 2.0,
    "nominal_flow_ml_min": 220.0,
    "nominal_spray_width_mm": 120.0,
    "target_thickness_um": 35.0
  },
  "signals": {
    "pressure_bar": 1.84,
    "flow_ml_min": 180.0,
    "spray_width_mm": 106.0,
    "thickness_um": 31.0,
    "viscosity_cp": 120.0,
    "temperature_c": 26.5
  },
  "robot": {
    "tcp_x_mm": 125.0,
    "tcp_y_mm": 240.0,
    "tcp_z_mm": 380.0,
    "speed_mm_s": 450.0,
    "stand_off_mm": 180.0
  }
}
